{
    "add-to-mmo": false,
    "address-changed": false,
    "address-type-from": "<redacted-address>",
    "address-type-to": "<redacted-address>",
    "barcode": "<redacted-barcode>",
    "completeness-checking": false,
    "delivery-time": {
        "max-days": 45,
        "min-days": 43
    },
    "delivery-to-door": false,
    "easy-return-recipient-payment": false,
    "forbidden-esp": false,
    "given-name": "<redacted-name>",
    "ground-rate": 64590,
    "ground-rate-with-vat": 78800,
    "ground-rate-wo-vat": 64590,
    "house-to": "<redacted-value>",
    "id": 0,
    "in-mmo": false,
    "index-to": 685000,
    "mail-category": "ORDINARY",
    "mail-direct": 643,
    "mail-rank": "WO_RANK",
    "mail-type": "POSTAL_PARCEL",
    "manual-address-input": false,
    "mass": 1000,
    "mass-rate": 64590,
    "mass-rate-with-vat": 78800,
    "mass-rate-wo-vat": 64590,
    "middle-name": "<redacted-name>",
    "order-num": "<redacted-order>",
    "payment-method": "CASHLESS",
    "place-to": "г. Магадан",
    "postmarks": [
        "NONSTANDARD"
    ],
    "postoffice-code": "109012",
    "pre-postal-preparation": false,
    "prepayment-return": false,
    "recipient-name": "<redacted-name>",
    "region-to": "обл. Магаданская",
    "str-index-to": "685000",
    "street-to": "<redacted-address>",
    "surname": "<redacted-name>",
    "tariff-count": 1,
    "tariff-type": "MASS",
    "tel-address": 0,
    "total-rate-wo-vat": 64590,
    "total-vat": 14210,
    "transport-type": "SURFACE",
    "unloading": false,
    "version": 1,
    "weight-pay": 1000,
    "with-client-return": false,
    "with-discount": false
}
